{
  "brief_id": "brief-green-tea-gift-20260812",
  "raw_brief": "新品牌青绿茶礼盒包装设计。渠道：一二线城市礼赠 + 电商礼盒；客群 28–45 新中产与商务馈赠；气质要求中式现代、不仿古堆砌；价格带中高端；需在详情页/礼盒开箱有清晰记忆点与差异化；工艺可接受材质升级或适度异形；类比可参考茶礼、黄酒礼盒、滋补礼盒与国际简约茶包装。",
  "created_at": "2026-08-12T11:58:34Z",
  "input": {
    "brand": "（演示）新品牌·青绿茶",
    "product": "青绿茶礼盒",
    "category_text": "绿茶 / 礼盒茶",
    "channel": "礼赠 + 电商礼盒",
    "audience": "28–45 新中产、商务馈赠",
    "price_band": "中高端",
    "culture_tone": "中式现代",
    "competitors": [
      "小罐茶礼盒（气质参照）",
      "国际精品茶礼（简约参照）"
    ],
    "must_have": [
      "开箱仪式感",
      "中式现代不仿古",
      "电商主图信息清晰",
      "礼赠体面"
    ],
    "must_avoid": [
      "寺庙仿古堆砌",
      "廉价金红喜庆模板",
      "信息过载看不清品类"
    ],
    "occasion": "节日/商务馈赠",
    "constraints": [
      "可材质升级",
      "可适度异形"
    ],
    "kuiyan_case_refs": [
      "中宝琯柚茶",
      "吾茶白",
      "石库门上海么糖（礼赠/海派现代可类比）"
    ]
  },
  "intent": {
    "domain_id": "tea_beverage",
    "domain_label_zh": "茶与即饮/新茶饮相关包装",
    "confidence": 0.92,
    "analogy_plan": [
      {
        "rule_id": "gift_occasion",
        "label_zh": "礼赠场",
        "targets": [
          "酒礼盒",
          "滋补礼盒",
          "糕点礼盒",
          "文创礼盒"
        ]
      },
      {
        "rule_id": "chinese_modern",
        "label_zh": "中式现代叙事",
        "targets": [
          "黄酒",
          "国潮美妆",
          "地方特产礼盒"
        ]
      },
      {
        "rule_id": "global_minimal",
        "label_zh": "国际简约",
        "targets": [
          "精品咖啡",
          "高端水",
          "香氛"
        ]
      }
    ],
    "query_plan": {
      "inspiration": [
        "green tea packaging design gift box",
        "青绿茶 礼盒 包装设计",
        "Chinese modern tea gift packaging"
      ],
      "shelf": [
        "天猫 绿茶礼盒 包装",
        "京东 高端茶礼盒"
      ],
      "analogy": [
        "huangjiu gift box packaging",
        "tcm tonic gift packaging modern",
        "minimal coffee gift box packaging"
      ]
    },
    "style_prior": [
      "chinese_modern",
      "chinese_ceremonial",
      "global_minimal",
      "regional_culture",
      "craft_material",
      "minimal_white"
    ],
    "risk_notes": [
      "礼赠茶货架易陷入金红仿古；需主动拉开",
      "样本阶段货架墙偏弱，需后续接电商深采"
    ]
  }
}